{
  "name": "data_grid",
  "description": "A typed, sortable, filterable and pageable data grid.",
  "authors": [
    "Marius Linnartz"
  ],
  "exclude": [
    "docs.md",
    "component.json"
  ],
  "cargoDependencies": [
    {
      "name": "dioxus-datagrid",
      "version": "0.13"
    }
  ],
  "globalAssets": [
    "../assets/dx-components-theme.css"
  ]
}
