{
  "name": "data_grid_reorder",
  "description": "Row reordering for data_grid: drag a row into another place, or move it with the keyboard.",
  "authors": [
    "Marius Linnartz"
  ],
  "exclude": [
    "docs.md",
    "component.json"
  ],
  "cargoDependencies": [
    {
      "name": "dioxus-datagrid",
      "version": "0.11"
    }
  ]
}
