{
  "name": "data_grid_detail",
  "description": "Detail rows for data_grid: a row opens a second one under itself, holding anything you render.",
  "authors": [
    "Marius Linnartz"
  ],
  "exclude": [
    "docs.md",
    "component.json"
  ],
  "cargoDependencies": [
    {
      "name": "dioxus-datagrid",
      "version": "0.13"
    }
  ]
}
