{
  "name": "data_grid_column_menu",
  "description": "A menu at every column header of data_grid: sort, group, pin, hide, fit the width.",
  "authors": [
    "Marius Linnartz"
  ],
  "exclude": [
    "docs.md",
    "component.json"
  ],
  "cargoDependencies": [
    {
      "name": "dioxus-datagrid",
      "version": "0.12"
    }
  ]
}
